============================= test session starts ==============================
platform linux -- Python 3.12.12, pytest-9.0.2, pluggy-1.6.0 -- /home/jules/.pyenv/versions/3.12.12/bin/python
cachedir: .pytest_cache
rootdir: /app
configfile: pyproject.toml
testpaths: tests
plugins: mock-3.15.1, anyio-4.12.0, asyncio-1.3.0
asyncio: mode=Mode.STRICT, debug=False, asyncio_default_fixture_loop_scope=None, asyncio_default_test_loop_scope=function
collecting ... collected 100 items / 8 errors

==================================== ERRORS ====================================
__________ ERROR collecting tests/handlers/test_callback_handlers.py ___________
ImportError while importing test module '/app/tests/handlers/test_callback_handlers.py'.
Hint: make sure your test modules/packages have valid Python names.
Traceback:
/home/jules/.pyenv/versions/3.12.12/lib/python3.12/importlib/__init__.py:90: in import_module
    return _bootstrap._gcd_import(name[level:], package, level)
           ^^^^^^^^^^^^^^^^^^^^^^^^^^^^^^^^^^^^^^^^^^^^^^^^^^^^
tests/handlers/test_callback_handlers.py:6: in <module>
    from telegram_bot.handlers.callback_handlers import button_handler
telegram_bot/handlers/callback_handlers.py:9: in <module>
    from ..services.download_manager import (
telegram_bot/services/download_manager.py:10: in <module>
    import libtorrent as lt
E   ModuleNotFoundError: No module named 'libtorrent'
___________ ERROR collecting tests/handlers/test_message_handlers.py ___________
ImportError while importing test module '/app/tests/handlers/test_message_handlers.py'.
Hint: make sure your test modules/packages have valid Python names.
Traceback:
/home/jules/.pyenv/versions/3.12.12/lib/python3.12/importlib/__init__.py:90: in import_module
    return _bootstrap._gcd_import(name[level:], package, level)
           ^^^^^^^^^^^^^^^^^^^^^^^^^^^^^^^^^^^^^^^^^^^^^^^^^^^^
tests/handlers/test_message_handlers.py:6: in <module>
    from telegram_bot.handlers.message_handlers import (
telegram_bot/handlers/message_handlers.py:11: in <module>
    from ..services.torrent_service import process_user_input
telegram_bot/services/torrent_service.py:11: in <module>
    import libtorrent as lt
E   ModuleNotFoundError: No module named 'libtorrent'
___________ ERROR collecting tests/services/test_download_manager.py ___________
ImportError while importing test module '/app/tests/services/test_download_manager.py'.
Hint: make sure your test modules/packages have valid Python names.
Traceback:
/home/jules/.pyenv/versions/3.12.12/lib/python3.12/importlib/__init__.py:90: in import_module
    return _bootstrap._gcd_import(name[level:], package, level)
           ^^^^^^^^^^^^^^^^^^^^^^^^^^^^^^^^^^^^^^^^^^^^^^^^^^^^
tests/services/test_download_manager.py:9: in <module>
    import libtorrent as lt
E   ModuleNotFoundError: No module named 'libtorrent'
____________ ERROR collecting tests/services/test_media_manager.py _____________
ImportError while importing test module '/app/tests/services/test_media_manager.py'.
Hint: make sure your test modules/packages have valid Python names.
Traceback:
/home/jules/.pyenv/versions/3.12.12/lib/python3.12/importlib/__init__.py:90: in import_module
    return _bootstrap._gcd_import(name[level:], package, level)
           ^^^^^^^^^^^^^^^^^^^^^^^^^^^^^^^^^^^^^^^^^^^^^^^^^^^^
tests/services/test_media_manager.py:6: in <module>
    from telegram_bot.services.media_manager import (
telegram_bot/services/media_manager.py:8: in <module>
    import libtorrent as lt
E   ModuleNotFoundError: No module named 'libtorrent'
___________ ERROR collecting tests/services/test_torrent_service.py ____________
ImportError while importing test module '/app/tests/services/test_torrent_service.py'.
Hint: make sure your test modules/packages have valid Python names.
Traceback:
/home/jules/.pyenv/versions/3.12.12/lib/python3.12/importlib/__init__.py:90: in import_module
    return _bootstrap._gcd_import(name[level:], package, level)
           ^^^^^^^^^^^^^^^^^^^^^^^^^^^^^^^^^^^^^^^^^^^^^^^^^^^^
tests/services/test_torrent_service.py:6: in <module>
    from telegram_bot.services.torrent_service import (
telegram_bot/services/torrent_service.py:11: in <module>
    import libtorrent as lt
E   ModuleNotFoundError: No module named 'libtorrent'
________________ ERROR collecting tests/test_batch_scanning.py _________________
ImportError while importing test module '/app/tests/test_batch_scanning.py'.
Hint: make sure your test modules/packages have valid Python names.
Traceback:
/home/jules/.pyenv/versions/3.12.12/lib/python3.12/importlib/__init__.py:90: in import_module
    return _bootstrap._gcd_import(name[level:], package, level)
           ^^^^^^^^^^^^^^^^^^^^^^^^^^^^^^^^^^^^^^^^^^^^^^^^^^^^
tests/test_batch_scanning.py:3: in <module>
    from telegram_bot.services import download_manager
telegram_bot/services/download_manager.py:10: in <module>
    import libtorrent as lt
E   ModuleNotFoundError: No module named 'libtorrent'
___________ ERROR collecting tests/workflows/test_search_workflow.py ___________
ImportError while importing test module '/app/tests/workflows/test_search_workflow.py'.
Hint: make sure your test modules/packages have valid Python names.
Traceback:
/home/jules/.pyenv/versions/3.12.12/lib/python3.12/importlib/__init__.py:90: in import_module
    return _bootstrap._gcd_import(name[level:], package, level)
           ^^^^^^^^^^^^^^^^^^^^^^^^^^^^^^^^^^^^^^^^^^^^^^^^^^^^
tests/workflows/test_search_workflow.py:6: in <module>
    from telegram_bot.workflows.search_workflow import (
telegram_bot/workflows/search_workflow.py:19: in <module>
    from ..services import search_logic, torrent_service, plex_service
telegram_bot/services/torrent_service.py:11: in <module>
    import libtorrent as lt
E   ModuleNotFoundError: No module named 'libtorrent'
_____ ERROR collecting tests/workflows/test_search_workflow_integration.py _____
ImportError while importing test module '/app/tests/workflows/test_search_workflow_integration.py'.
Hint: make sure your test modules/packages have valid Python names.
Traceback:
/home/jules/.pyenv/versions/3.12.12/lib/python3.12/importlib/__init__.py:90: in import_module
    return _bootstrap._gcd_import(name[level:], package, level)
           ^^^^^^^^^^^^^^^^^^^^^^^^^^^^^^^^^^^^^^^^^^^^^^^^^^^^
tests/workflows/test_search_workflow_integration.py:8: in <module>
    from telegram_bot.workflows import search_workflow
telegram_bot/workflows/search_workflow.py:19: in <module>
    from ..services import search_logic, torrent_service, plex_service
telegram_bot/services/torrent_service.py:11: in <module>
    import libtorrent as lt
E   ModuleNotFoundError: No module named 'libtorrent'
=============================== warnings summary ===============================
tests/services/test_download_manager.py:94
  /app/tests/services/test_download_manager.py:94: SyntaxWarning: invalid escape sequence '\.'
    assert "*Speed:* 0\.00 MB/s" in kwargs["text"]

telegram_bot/workflows/search_workflow.py:578
  /app/telegram_bot/workflows/search_workflow.py:578: SyntaxWarning: invalid escape sequence '\.'
    f"S{int(season):02d} already exist in your library\. Nothing to download\."

telegram_bot/workflows/search_workflow.py:592
  /app/telegram_bot/workflows/search_workflow.py:592: SyntaxWarning: invalid escape sequence '\.'
    "I will only fetch the missing episodes\. Choose a resolution:"

telegram_bot/workflows/search_workflow.py:601
  /app/telegram_bot/workflows/search_workflow.py:601: SyntaxWarning: invalid escape sequence '\.'
    "You may download a season pack if available\. Choose a resolution:"

telegram_bot/workflows/search_workflow.py:1113
  /app/telegram_bot/workflows/search_workflow.py:1113: SyntaxWarning: invalid escape sequence '\.'
    f"S{int(season):02d} already exist in your library\."

-- Docs: https://docs.pytest.org/en/stable/how-to/capture-warnings.html
=========================== short test summary info ============================
ERROR tests/handlers/test_callback_handlers.py
ERROR tests/handlers/test_message_handlers.py
ERROR tests/services/test_download_manager.py
ERROR tests/services/test_media_manager.py
ERROR tests/services/test_torrent_service.py
ERROR tests/test_batch_scanning.py
ERROR tests/workflows/test_search_workflow.py
ERROR tests/workflows/test_search_workflow_integration.py
!!!!!!!!!!!!!!!!!!! Interrupted: 8 errors during collection !!!!!!!!!!!!!!!!!!!!
======================== 5 warnings, 8 errors in 1.06s =========================
